weekabout,targetlearner,description,language,creator,coursename,imageurl,instructors,weekgraded,url,ratingcount,ratingstars,basicinfo,weekinfo,weekname
"([""For the course \xe2\x80\x9cDeep Learning for Business,\xe2\x80\x9d the first module is \xe2\x80\x9cDeep Learning Products & Services,\xe2\x80\x9d which starts with the lecture \xe2\x80\x9cFuture Industry Evolution & Artificial Intelligence\xe2\x80\x9d that explains past, current, and future industry evolutions and how DL (Deep Learning) and ML (Machine Learning) technology will be used in almost every aspect of future industry in the near future. The following lectures look into the hottest DL and ML products and services that are exciting the business world. First, the \xe2\x80\x9cJeopardy!\xe2\x80\x9d winning versatile IBM Watson is introduced along with its DeepQA and AdaptWatson systems that use DL technology. Then the Amazon Echo and Echo Dot products are introduced along with the Alexa cloud based DL personal assistant that uses ASR (Automated Speech Recognition) and NLU (Natural Language Understanding) technology. The next lecture focuses on LettuceBot, which is a DL system that plants lettuce seeds with automatic fertilizer and herbicide nozzles control. Then the computer vision based DL blood cells analysis diagnostic system Athelas is introduced followed by the introduction of a classical and symphonic music composing DL system named AIVA (Artificial Intelligence Virtual Artist). As the last topic of module 1, the upcoming Apple watchOS 4 and the HomePod speaker that was presented at Apple's 2017 WWDC (World Wide Developers Conference) is introduced."", 'The second module \xe2\x80\x9cBusiness with Deep Learning & Machine Learning\xe2\x80\x9d first focuses on various business considerations based on changes to come due to DL (Deep Learning) and ML (Machine Learning) technology in the lecture \xe2\x80\x9cBusiness Considerations in the Machine Learning Era.\xe2\x80\x9d In the following lecture \xe2\x80\x9cBusiness Strategy with Machine Learning & Deep Learning\xe2\x80\x9d explains the changes that are needed to be more successful in business, and provides an example of business strategy modeling based on the three stages of preparation, business modeling, and model rechecking & adaptation. The next lecture \xe2\x80\x9cWhy is Deep Learning Popular Now?\xe2\x80\x9d explains the changes in recent technology and support systems that enable the DL systems to perform with amazing speed, accuracy, and reliability. The last lecture \xe2\x80\x9cCharacteristics of Businesses with DL & ML\xe2\x80\x9d first explains DL and ML based business characteristics based on data types, followed by DL & ML deployment options, the competitive landscape, and future opportunities are also introduced.', 'The third module \xe2\x80\x9cDeep Learning Computing Systems & Software\xe2\x80\x9d focuses on the most significant DL (Deep Learning) and ML (Machine Learning) systems and software. Except for the NVIDIA DGX-1, the introduced DL systems and software in this module are not for sale, and therefore, may not seem to be important for business at first glance. But in reality, the companies that created these systems and software are indeed the true leaders of the future DL and ML business era. Therefore, this module introduces the true state-of-the-art level of DL and ML technology. The first lecture introduces the most popular DL open source software TensorFlow, CNTK (Cognitive Toolkit), Keras, Caffe, Theano, and their characteristics. Due to their popularly, strong influence, and diverse capabilities, the following lectures introduce the details of Google TensorFlow and Microsoft CNTK. Next, NVIDIA s supercomputer DGX-1, that has fully integrated customized DL hardware and software, is introduced. In the following lectures, the most interesting competition of human versus machine is introduced in the Google AlphaGo lecture, and in the ILSVRC (ImageNet Large Scale Visual Recognition Challenge) lecture, the results of competition between cutting edge DL systems is introduced and the winning performance for each year is compared.', 'The module \xe2\x80\x9cBasics of Deep Learning Neural Networks\xe2\x80\x9d first focuses on explaining the technical differences of AI (Artificial Intelligence), ML (Machine Learning), and DL (Deep Learning) in the first lecture titled \xe2\x80\x9cWhat is DL (Deep Learning) and ML (Machine Learning).\xe2\x80\x9d In addition, the characteristics of CPUs (Central Processing Units) and GPUs (Graphics Processing Units) used in DL as well as the representative computer performance units of FLOPS (FLoating-Point Operations Per Second) and IPS (Instructions Per Second) are introduced. Next, in the NN (Neural Network) lecture, the biological neuron (nerve cell) and its signal transfer is introduced followed by an ANN (Artificial Neural Network) model of a neuron based on a threshold logic unit and soft output activation functions is introduced. Then the extended NN technologies that uses MLP (Multi-Layer Perceptron), SoftMax, and AutoEncoder are explained. In the last lecture of the module, NN learning based on backpropagation is introduced along with the learning method types, which include supervised learning, unsupervised learning, semi-supervised learning, and reinforcement learning.', ""The module \xe2\x80\x9cDeep Learning with CNN & RNN\xe2\x80\x9d focuses on CNN (Convolutional Neural Network) and RNN (Recurrent Neural Network) technology that enable DL (Deep Learning). First the lectures introduce how CNNs used in image/video recognition, recommender systems, natural language processing, and games (like Chess and Go) are made possible through processing in the convolutional layer and feature maps. The lecture also introduces how CNNs use subsampling (pooling), LCN (Local Contrast Normalization), dropout, ensemble, and bagging technology to become more efficient, reliable, robust, and accurate. Next, the lectures introduce how DL with RNN is used in speech recognition (as in Apple's Siri, Google s Voice Search, and Samsung's S Voice), handwriting recognition, sequence data analysis, and program code generation. Then the details of RNN technologies are introduced, which include S2S (Sequence to Sequence) learning, forward RNN, backward RNN, representation techniques, context based projection, and representation with attention. As the last part of the module, the early model of RNN, which is the FRNN (Fully Recurrent NN), and the currently popular RNN model LSTM (Long Short-Term Memory) is introduced."", 'The module \xe2\x80\x9cDeep Learning Project with TensorFlow Playground\xe2\x80\x9d focuses on four NN (Neural Network) design projects, where experience on designing DL (Deep Learning) NNs can be gained using a fun and powerful application called the TensorFlow Playground. The lectures first teach how to use the TensorFlow Playground, which is followed by guidance on three projects so you can easily buildup experience on using the TensorFlow Playground system. Then in Project 4 a \xe2\x80\x9cDL NN Design Challenge\xe2\x80\x9d is given, where you will need to make the NN \xe2\x80\x9cDeeper\xe2\x80\x9d by adding hidden layers and neurons to satisfy the classification objectives. The knowledge you obtained in the lecture of Modules 1~5 will be used in these projects.'],)","([],)","(['Your smartphone, smartwatch, and automobile (if it is a newer model) have AI (Artificial Intelligence) inside serving you every day. In the near future, more advanced \xe2\x80\x9cself-learning\xe2\x80\x9d capable DL (Deep Learning) and ML (Machine Learning) technology will be used in almost every aspect of your business and industry. So now is the right time to learn what DL and ML is and how to use it in advantage of your company. This course has three parts, where the first part focuses on DL and ML technology based future business strategy including details on new state-of-the-art products/services and open source DL software, which are the future enablers. The second part focuses on the core technologies of DL and ML systems, which include NN (Neural Network), CNN (Convolutional NN), and RNN (Recurrent NN) systems. The third part focuses on four TensorFlow Playground projects, where experience on designing DL NNs can be gained using an easy and fun yet very powerful application called the TensorFlow Playground. This course was designed to help you build business strategies and enable you to conduct technical planning on new DL and ML services and products.'],)","(['English'],)","(['Yonsei University'],)","(['Deep Learning for Business'],)",https://d3njjcbhbojbot.cloudfront.net/api/utilities/v1/imageproxy/https://coursera-course-photos.s3.amazonaws.com/d4/190440653911e7b5ddcbc8c971bacc/jmc_thum_DeepLearning.jpg?auto=format%2Ccompress&dpr=2&exp=-10&blur=10&bri=5&max-w=1000,"(['Jong-Moon Chung'],)","(['Graded Quiz', 'Graded Quiz', 'Graded Quiz', 'Graded Quiz', 'Graded Quiz'],)",https://www.coursera.org/learn/deep-learning-business,61,"(['Rated 4.4 out of 5 of ', ' ratings'],)","(['Beginner', 'Pass all graded assignments to complete the course.'],)","(['5 videos', ', ', '1 practice quiz', '4 videos', ', ', '1 practice quiz', '4 videos', ', ', '1 practice quiz', '3 videos', ', ', '1 practice quiz', '2 videos', ', ', '1 practice quiz', '3 videos'],)","(['Deep Learning Products & Services ', 'Business with Deep Learning & Machine Learning', 'Deep Learning Computing Systems & Software', 'Basics of Deep Learning Neural Networks', 'Deep Learning with CNN & RNN ', 'Deep Learning Project with  TensorFlow Playground'],)"
"([],)","(['This course is for those who are interested in NLP field and want to know the current state-of-the-art in research and production. We expect that you have already taken some courses on machine learning and deep learning, but probably have never applied those models to texts and want to get a quick start.'],)","(['This course covers a wide range of tasks in Natural Language Processing from basic to advanced: sentiment analysis, summarization, dialogue state tracking, to name a few. Upon completing, you will be able to recognize NLP tasks in your day-to-day work, propose approaches, and judge what techniques are likely to work well.  The final project is devoted to one of the most hot topics in today\xe2\x80\x99s NLP. You will build your own conversational chat-bot that will assist with search on StackOverflow website. The project will be based on practical assignments of the course, that will give you hands-on experience with such tasks as text classification, named entities recognition, and duplicates detection. \n\nThroughout the lectures, we will aim at finding a balance between traditional and deep learning techniques in NLP and cover them in parallel. For example, we will discuss word alignment models in machine translation and see how similar it is to attention mechanism in encoder-decoder neural networks. Core techniques are not treated as black boxes. On the contrary, you will get in-depth understanding of what\xe2\x80\x99s happening inside. To succeed in that, we expect your familiarity with the basics of linear algebra and probability theory, machine learning setup, and deep neural networks. Some materials are based on one-month-old papers and introduce you to the very state-of-the-art in NLP research.'],)","(['English'],)","(['National Research University Higher School of Economics'],)","(['Natural Language Processing'],)",https://d3njjcbhbojbot.cloudfront.net/api/utilities/v1/imageproxy/https://coursera-course-photos.s3.amazonaws.com/df/324a90b06511e7958c7f63f0f736f7/Natural-language-processing-.png?auto=format%2Ccompress&dpr=2&exp=-10&blur=10&bri=5&max-w=1000,"(['Anna Potapenko', 'Alexey Zobnin', 'Anna Kozlova', 'Sergey Yudin', 'Andrei Zimovnov'],)","([],)",https://www.coursera.org/learn/language-processing,,"([],)","(['Advanced', '5 weeks of study', 'Pass all graded assignments to complete the course.'],)","([],)","([],)"
"([],)","([],)","([],)","([],)","([],)","([],)",,"([],)","([],)",https://www.coursera.org/specializations/learn-spanish,,"([],)","([],)","([],)","([],)"
"([],)","([],)","([],)","([],)","([],)","([],)",,"([],)","([],)",https://www.coursera.org/specializations/learn-mandarin,,"([],)","([],)","([],)","([],)"
"([],)","(['This advanced undergraduate course provides a molecular-level understanding of thermodynamics and covers the application of statistical thermodynamics to several important engineering and biological systems.'],)","(['Modern engineering research focuses on designing new materials and processes at the molecular level. Statistical thermodynamics provides the formalism for understanding how molecular interactions lead to the observed collective behavior at the macroscale. \n\nThis course will develop a molecular-level understanding of key thermodynamic quantities like heat, work, free energy and entropy. These concepts will be applied in understanding several important engineering and biological applications.'],)","(['English'],)","(['Carnegie Mellon University'],)","(['Statistical Thermodynamics: Molecules to Machines'],)",https://d3njjcbhbojbot.cloudfront.net/api/utilities/v1/imageproxy/https://coursera-course-photos.s3.amazonaws.com/a5/aff3a0ce4311e49136915d63055160/logo_notitle.png?auto=format%2Ccompress&dpr=2&exp=-10&blur=10&bri=5&max-w=1000,"(['Venkat Viswanathan'],)","(['Assignment 1', 'Assignment 2', 'Assignment 3', 'Assignment 4', 'Assignment 5', 'Assignment 6'],)",https://www.coursera.org/learn/statistical-thermodynamics-cm,24,"(['Rated 3.8 out of 5 of ', ' ratings'],)","(['Intermediate', 'Pass all graded assignments to complete the course.'],)","(['4 videos', ', ', '2 practice quizzes', '2 videos', '5 videos', '3 videos', '3 videos', '3 videos', '4 videos', '1 video'],)","(['Theory: Classical Thermodynamics', 'Theory: Introduction to Statistics and Statistical Thermodynamics', 'Theory: Non-interacting systems', 'Theory: Interacting systems', 'Applications: Water, Polymer and Photosynthesis', 'Applications: Photosynthesis, Liquids', 'Application: Adsorption, Electrolytes', 'Thank You'],)"
"(['The purpose of this module is to introduce spectrum of sensors used to implement intelligent machining. The module will also discuss the basics of signal processing and analysis techniques that has brought intelligent machining paradigm closer to industrial realization. Following issues pertaining to sensors and sensing techniques will be elaborated up: (1) Which sensors are to be used in each application? (2) How to acquire and process sensor signals? \n'],)","(['This course is for anyone interested in how digital advances are changing the landscape and capabilities of manufacturing, from high school graduates exploring careers to operations managers and business owners hungry for an understanding of the newest manufacturing technologies.'],)","(['Manufacturers are increasingly utilizing machine tools that are self-aware \xe2\x80\x93 they perceive their own states and the state of the surrounding environment \xe2\x80\x93 and are able to make decisions related to machine activity processes. This is called intelligent machining, and through this course students will receive a primer on its background, tools and related terminology. \n\nLearn how the integration of smart sensors and controls are helping to improve productivity. You\xe2\x80\x99ll be exposed to various sensors and sensing techniques, process control strategies, and open architecture systems that can be leveraged to enable intelligent machining. This course will prepare you to contribute to the implementation of intelligent machining projects. \n\nMain concepts of this course will be delivered through lectures, readings, discussions and various videos. \n\nThis is the fifth course in the Digital Manufacturing & Design Technology specialization that explores the many facets of manufacturing\xe2\x80\x99s \xe2\x80\x9cFourth Revolution,\xe2\x80\x9d and features a culminating project involving creation of a roadmap to achieve a self-established DMD-related professional goal.\n\nTo learn more about the Digital Manufacturing and Design Technology specialization, please watch the overview video by copying and pasting the following link into your web browser: https://youtu.be/r-VHiwsg_t0'],)","(['English'],)","(['University at Buffalo', 'The State University of New York'],)","(['Intelligent Machining'],)",https://d3njjcbhbojbot.cloudfront.net/api/utilities/v1/imageproxy/https://coursera-course-photos.s3.amazonaws.com/27/5b50d0acdb11e6bd5ebb7f1735cf92/Intelligent-Machining_banner-2.png?auto=format%2Ccompress&dpr=2&exp=-10&blur=10&bri=5&max-w=1000,"(['Rahul Rai'],)","(['Introduction to Intelligent Machining', 'Sensors and Sensing Techniques', 'Process Control Strategies', 'Intelligent Machining- Future Directions '],)",https://www.coursera.org/learn/intelligent-machining,33,"(['Rated 4.5 out of 5 of ', ' ratings'],)","(['Beginner', '4 weeks of study, 3 \xc2\xbd hours per week', 'Pass all graded assignments to complete the course.'],)","(['4 videos', ', ', '4 readings', ', ', '3 practice quizzes', '4 videos', ', ', '3 readings', ', ', '4 practice quizzes', '4 videos', ', ', '4 readings', ', ', '4 practice quizzes', '3 videos', ', ', '5 readings', ', ', '1 practice quiz'],)","(['Introduction to Intelligent Machining ', 'Sensors and Sensing Techniques', 'Process Control Strategies', 'Future Directions in Advanced Machining'],)"
"(['Welcome to the ""Introduction to Deep Learning"" course! In the first week you\'ll learn about linear models and stochatic optimization methods. Linear models are basic building blocks for many deep architectures, and stochastic optimization is used to learn every model that we\'ll discuss in our course.'],)","(['Developers, analysts and researchers who are faced with tasks involving complex structure understanding such as image, sound and text analysis.'],)","(['The goal of this course is to give learners basic understanding of modern neural networks and their applications in computer vision and natural language understanding. The course starts with a recap of linear models and discussion of stochastic optimization methods that are crucial for training deep neural networks. Learners will study all popular building blocks of neural networks including fully connected layers, convolutional and recurrent layers. \nLearners will use these building blocks to define complex modern architectures in TensorFlow and Keras frameworks. In the course project learner will implement deep neural network for the task of image captioning which solves the problem of giving a text description for an input image.\n\nThe prerequisites for this course are: \n1) Basic knowledge of Python.\n2) Basic linear algebra and probability.\n\nPlease note that this is an advanced course and we assume basic knowledge of machine learning. You should understand:\n1) Linear regression: mean squared error, analytical solution.\n2) Logistic regression: model, cross-entropy loss, class probability estimation.\n3) Gradient descent for linear models. Derivatives of MSE and cross-entropy loss functions.\n4) The problem of overfitting.\n5) Regularization for linear models.'],)","(['English'],)","(['National Research University Higher School of Economics'],)","(['Introduction to Deep Learning'],)",https://d3njjcbhbojbot.cloudfront.net/api/utilities/v1/imageproxy/https://coursera-course-photos.s3.amazonaws.com/35/83c3d08f2111e7bd2205ef015e40cc/Deep-learning-for-computer-vision.png?auto=format%2Ccompress&dpr=2&exp=-10&blur=10&bri=5&max-w=1000,"(['Evgeny Sokolov', 'Andrei Zimovnov', 'Alexander Panin', 'Ekaterina Lobacheva', 'Nikita Kazeev'],)","(['Linear models', 'Overfitting and regularization', 'Linear models and optimization', 'Logistic regression in TensorFlow', 'my1stNN', 'my1stNN - Keras this time', 'Your very own neural network', 'Convolutions and pooling', 'Your first CNN on CIFAR-10', 'Fine-tuning InceptionV3 for flowers classification', 'Simple autoencoder', 'Word embeddings', 'Generative adversarial networks', 'RNN and Backpropagation', 'Generating names with RNNs', 'Modern RNNs', 'How to use RNNs', 'Image Captioning Final Project', 'Image Captioning Final Project'],)",https://www.coursera.org/learn/intro-to-deep-learning,74,"(['Rated 4.3 out of 5 of ', ' ratings'],)","(['Advanced', '6 weeks of study, 6-10 hours/week', 'Pass all graded assignments to complete the course.'],)","(['7 videos', ', ', '1 reading', '8 videos', ', ', '1 practice quiz', '6 videos', '9 videos', '6 videos', '3 items'],)","(['Introduction to optimization', 'Introduction to neural networks', 'Deep Learning for images', 'Unsupervised representation learning', 'Deep learning for sequences', 'Final Project'],)"
"([],)","(['The course is designed for people\n(1) who already know the basics of machine learning and deep learning \n(2) who have never studied image processing and computer vision and want to fill that gap\n(3) who want to learn how to solve computer vision problems with deep learning. '],)","(['Deep learning added a huge boost to the already rapidly developing field of computer vision. With deep learning, a lot of new applications of computer vision techniques have been introduced and are now becoming parts of our everyday lives. These include face recognition and indexing, photo stylization or machine vision in self-driving cars. \nThe goal of this course is to introduce students to computer vision, starting from basics and then turning to more modern deep learning models. We will cover both image and video recognition, including image classification and annotation, object recognition and image search, various object detection techniques, motion estimation, object tracking in video, human action recognition, and finally image stylization, editing and new image generation. In course project, students will learn how to build face recognition and manipulation system to understand the internal mechanics of this technology, probably the most renown and oftenly demonstrated in movies and TV-shows example of computer vision and AI.'],)","(['English'],)","(['National Research University Higher School of Economics'],)","(['Deep Learning in Computer Vision'],)",https://d3njjcbhbojbot.cloudfront.net/api/utilities/v1/imageproxy/https://coursera-course-photos.s3.amazonaws.com/f4/73a8908f2211e7be561d79af9860d8/Deep-learning-for-computer-vision.png?auto=format%2Ccompress&dpr=2&exp=-10&blur=10&bri=5&max-w=1000,"(['Anton Konushin', 'Alexey Artemov'],)","([],)",https://www.coursera.org/learn/deep-learning-in-computer-vision,,"([],)","(['Advanced', '6 weeks of study', 'Pass all graded assignments to complete the course.'],)","([],)","([],)"
"([],)","(['The course is designed for people  (1) who already know the basics of machine learning and want to broaden their horizons (2) who have never studied the specifics of reinforcement learning and want to fill that gap  (3) who want to understand the methods and details standing behind the breaking AI news.'],)","(['The goal of \xc2\xabIntro to Reinforcement learning\xc2\xbb is in its name: introduce students to reinforcement learning \xe2\x80\x93 the prominent area of modern research in artificial intelligence.  The reinforcement learning differs much from both supervised and unsupervised learning and is more about how humans learn in reality.  \nStudents will learn from this course both theoretical core and recent practical RL methods. Most importantly, they will learn how to apply such methods to practical problems. In six weeks students will be guided through the basics of Reinforcement Learning (RL):  we will talk about essential theory of RL, value-based methods (such as SARSA and Q-learning), policy based algorithms and methods, designed to solve the optimal exploration problem. In addition to algorithms and theory, during the course we will also present useful practical tips and tricks, needed for learning stabilization, and study how to apply the methods to large scale problems with deep neural networks.'],)","(['English'],)","(['National Research University Higher School of Economics'],)","(['Practical Reinforcement Learning'],)",https://d3njjcbhbojbot.cloudfront.net/api/utilities/v1/imageproxy/https://coursera-course-photos.s3.amazonaws.com/b7/5e73908f2211e7a194c734339bf54e/Reinforcement-learning.png?auto=format%2Ccompress&dpr=2&exp=-10&blur=10&bri=5&max-w=1000,"(['Pavel Shvechikov', 'Alexander Panin'],)","([],)",https://www.coursera.org/learn/practical-rl,,"([],)","(['Intermediate', '6 weeks of study', 'Pass all graded assignments to complete the course.'],)","([],)","([],)"
