weekabout,targetlearner,description,language,creator,coursename,imageurl,instructors,weekgraded,url,ratingcount,ratingstars,basicinfo,weekinfo,weekname
"(['Classification is one of the most widely used techniques in machine learning, with a broad array of applications, including sentiment analysis, ad targeting, spam detection, risk assessment, medical diagnosis and image classification. The core goal of classification is to predict a category or class y from some inputs x. Through this course, you will become familiar with the fundamental models and algorithms used in classification, as well as a number of core machine learning concepts. Rather than covering all aspects of classification, you will focus on a few core techniques, which are widely used in the real-world to get state-of-the-art performance. By following our hands-on approach, you will implement your own algorithms on multiple real-world tasks, and deeply grasp the core techniques needed to be successful with these approaches in practice. This introduction to the course provides you with an overview of the topics we will cover and the background knowledge and resources we assume you have.', 'Linear classifiers are amongst the most practical classification methods. For example, in our sentiment analysis case-study, a linear classifier associates a coefficient with the counts of each word in the sentence. In this module, you will become proficient in this type of representation. You will focus on a particularly useful type of linear classifier called logistic regression, which, in addition to allowing you to predict a class, provides a probability associated with the prediction. These probabilities are extremely useful, since they provide a degree of confidence in the predictions. In this module, you will also be able to construct features from categorical inputs, and to tackle classification problems with more than two class (multiclass problems). You will examine the results of these techniques on a real-world product sentiment analysis task.', 'Once familiar with linear classifiers and logistic regression, you can now dive in and write your first learning algorithm for classification. In particular, you will use gradient ascent to learn the coefficients of your classifier from data. You first will need to define the quality metric for these tasks using an approach called maximum likelihood estimation (MLE). You will also become familiar with a simple technique for selecting the step size for gradient ascent. An optional, advanced part of this module will cover the derivation of the gradient for logistic regression.  You will implement your own learning algorithm for logistic regression from scratch, and use it to learn a sentiment analysis classifier.', ""As we saw in the regression course, overfitting is perhaps the most significant challenge you will face as you apply machine learning approaches in practice. This challenge can be particularly significant for logistic regression, as you will discover in this module, since we not only risk getting an overly complex decision boundary, but your classifier can also become overly confident about the probabilities it predicts. In this module, you will investigate overfitting in classification in significant detail, and obtain broad practical insights from some interesting visualizations of the classifiers' outputs. You will then add a regularization term to your optimization to mitigate overfitting. You will investigate both L2 regularization to penalize large coefficient values, and L1 regularization to obtain additional sparsity in the coefficients. Finally, you will modify your gradient ascent algorithm to learn regularized logistic regression classifiers. You will implement your own regularized logistic regression classifier from scratch, and investigate the impact of the L2 penalty on real-world sentiment analysis data."", 'Along with linear classifiers, decision trees are amongst the most widely used classification techniques in the real world. This method is extremely intuitive, simple to implement and provides interpretable predictions. In this module, you will become familiar with the core decision trees representation. You will then design a simple, recursive greedy algorithm to learn decision trees from data. Finally, you will extend this approach to deal with continuous inputs, a fundamental requirement for practical problems. In this module, you will investigate a brand new case-study in the financial sector: predicting the risk associated with a bank loan. You will implement your own decision tree learning algorithm on real loan data.', ""Out of all machine learning techniques, decision trees are amongst the most prone to overfitting. No practical implementation is possible without including approaches that mitigate this challenge. In this module, through various visualizations and investigations, you will investigate why decision trees suffer from significant overfitting problems. Using the principle of Occam's razor, you will mitigate overfitting by learning simpler trees. At first, you will design algorithms that stop the learning process before the decision trees become overly complex. In an optional segment, you will design a very practical approach that learns an overly-complex tree, and then simplifies it with pruning. Your implementation will investigate the effect of these techniques on mitigating overfitting on our real-world loan data set. "", 'Real-world machine learning problems are fraught with missing data. That is, very often, some of the inputs are not observed for all data points. This challenge is very significant, happens in most cases, and needs to be addressed carefully to obtain great performance. And, this issue is rarely discussed in machine learning courses. In this module, you will tackle the missing data challenge head on. You will start with the two most basic techniques to convert a dataset with missing data into a clean dataset, namely skipping missing values and inputing missing values. In an advanced section, you will also design a modification of the decision tree learning algorithm that builds decisions about missing data right into the model. You will also explore these techniques in your real-data implementation.  ', ""One of the most exciting theoretical questions that have been asked about machine learning is whether simple classifiers can be combined into a highly accurate ensemble. This question lead to the developing of boosting, one of the most important and practical techniques in machine learning today. This simple approach can boost the accuracy of any classifier, and is widely used in practice, e.g., it's used by more than half of the teams who win the Kaggle machine learning competitions. In this module, you will first define the ensemble classifier, where multiple models vote on the best prediction. You will then explore a boosting algorithm called  AdaBoost, which provides a great approach for boosting classifiers. Through visualizations, you will become familiar with many of the practical aspects of this techniques. You will create your very own implementation of AdaBoost, from scratch, and use it to boost the performance of your loan risk predictor on real data. "", 'In many real-world settings, accuracy or error are not the best quality metrics for classification. You will explore a case-study that significantly highlights this issue: using sentiment analysis to display positive reviews on a restaurant website. Instead of accuracy, you will define two metrics: precision and recall, which are widely used in real-world applications to measure the quality of classifiers. You will explore how the probabilities output by your classifier can be used to trade-off precision with recall, and dive into this spectrum, using precision-recall curves. In your hands-on implementation, you will compute these metrics with your learned classifier on real-world sentiment analysis data.', 'With the advent of the internet, the growth of social media, and the embedding of sensors in the world, the magnitudes of data that our machine learning algorithms must handle have grown tremendously over the last decade. This effect is sometimes called ""Big Data"". Thus, our learning algorithms must scale to bigger and bigger datasets. In this module, you will develop a small modification of gradient ascent called stochastic gradient, which provides significant speedups in the running time of our algorithms. This simple change can drastically improve scaling, but makes the algorithm less stable and harder to use in practice. In this module, you will investigate the practical techniques needed to make stochastic gradient viable, and to thus to obtain learning algorithms that scale to huge datasets. You will also address a new kind of machine learning problem, online learning, where the data streams in over time, and we must learn the coefficients as the data arrives. This task can also be solved with stochastic gradient. You will implement your very own stochastic gradient ascent algorithm for logistic regression from scratch, and evaluate it on sentiment analysis data. '],)","([],)","([""Case Studies: Analyzing Sentiment & Loan Default Prediction\n\nIn our case study on analyzing sentiment, you will create models that predict a class (positive/negative sentiment) from input features (text of the reviews, user profile information,...).  In our second case study for this course, loan default prediction, you will tackle financial data, and predict when a loan is likely to be risky or safe for the bank. These tasks are an examples of classification, one of the most widely used areas of machine learning, with a broad array of applications, including ad targeting, spam detection, medical diagnosis and image classification. \n\nIn this course, you will create classifiers that provide state-of-the-art performance on a variety of tasks.  You will become familiar with  the most successful techniques, which are most widely used in practice, including logistic regression, decision trees and boosting.  In addition, you will be able to design and implement the underlying algorithms that can learn these models at scale, using stochastic gradient ascent.  You will implement these technique on real-world, large-scale machine learning tasks.  You will also address significant tasks you will face in real-world applications of ML, including handling missing data and measuring precision and recall to evaluate a classifier.  This course is hands-on, action-packed, and full of visualizations and illustrations of how these techniques will behave on real data.  We've also included optional content in every module, covering advanced topics for those who want to go even deeper! \n\nLearning Objectives: By the end of this course, you will be able to:\n   -Describe the input and output of a classification model.\n   -Tackle both binary and multiclass classification problems.\n   -Implement a logistic regression model for large-scale classification.  \n   -Create a non-linear model using decision trees.\n   -Improve the performance of any model using boosting.\n   -Scale your methods with stochastic gradient ascent.\n   -Describe the underlying decision boundaries.  \n   -Build a classification model to predict sentiment in a product review dataset.  \n   -Analyze financial data to predict loan defaults.\n   -Use techniques for handling missing data.\n   -Evaluate your models using precision-recall metrics.\n   -Implement these techniques in Python (or in the language of your choice, though Python is highly recommended).""],)","(['English'],)","(['University of Washington'],)","(['Machine Learning: Classification'],)",https://d3njjcbhbojbot.cloudfront.net/api/utilities/v1/imageproxy/https://coursera-course-photos.s3.amazonaws.com/b1/37a1a04d0011e59bd777c2a1ef6a6e/gears-818461_1280.jpg?auto=format%2Ccompress&dpr=2&exp=-10&blur=10&bri=5&max-w=1000,"(['Carlos Guestrin', 'Emily Fox'],)","(['Linear Classifiers & Logistic Regression', 'Predicting sentiment from product reviews', 'Learning Linear Classifiers', 'Implementing logistic regression from scratch', 'Overfitting & Regularization in Logistic Regression', 'Logistic Regression with L2 regularization', 'Decision Trees', 'Identifying safe loans with decision trees', 'Implementing binary decision trees', 'Preventing Overfitting in Decision Trees', 'Decision Trees in Practice', 'Handling Missing Data', 'Exploring Ensemble Methods', 'Boosting', 'Boosting a decision stump', 'Precision-Recall', 'Exploring precision and recall', 'Scaling to Huge Datasets & Online Learning', 'Training Logistic Regression via Stochastic Gradient Ascent'],)",https://www.coursera.org/learn/ml-classification,"1,925","(['Rated 4.7 out of 5 of ', ' ratings'],)","(['7 weeks of study, 5-8 hours/week', 'Pass all graded assignments to complete the course.'],)","(['8 videos', ', ', '2 readings', '18 videos', ', ', '2 readings', '18 videos', ', ', '2 readings', '13 videos', ', ', '2 readings', '13 videos', ', ', '3 readings', '8 videos', ', ', '2 readings', '6 videos', ', ', '1 reading', '13 videos', ', ', '3 readings', '8 videos', ', ', '2 readings', '16 videos', ', ', '2 readings'],)","(['Welcome!', 'Linear Classifiers & Logistic Regression', 'Learning Linear Classifiers', 'Overfitting & Regularization in Logistic Regression', 'Decision Trees', 'Preventing Overfitting in Decision Trees', 'Handling Missing Data', 'Boosting', 'Precision-Recall', 'Scaling to Huge Datasets & Online Learning'],)"
"(['This first week gives an introduction to the course and asks what it is to be a teacher. This is a chance for you to reflect on you own identity and aspirations as a teacher and gain an informed understanding of the world, or worlds, of childhood. You will build on and extend your existing knowledge as a teacher. We will discuss the ways in which teaching can be defined as a profession and what it means to be a professional teacher.', 'The videos in this week are all related to the theme of children and young people s learning. The emphasis is on thinking \xe2\x80\x98skills  \xe2\x80\x93 learning how to think effectively and creatively. We ask how you as a teacher ensure that students are thinking while they are in your classroom. You will write an essay which brings together the various strands of your learning. This is for your own professional development, but it will also help you to consider what the implications are for teaching and learning in your own classroom.', 'This week is focused on the classroom and asks you to consider the question \xe2\x80\x98How good is my classroom?  It asks you to revisit, replay, and bring together the many ingredients that make a classroom a stimulating place for learning and an enjoyable and engaging place for teaching. We come back to the importance of assessment for learning. As Dylan Wiliam says, \xe2\x80\x98assessment is minute by minute in the classroom , not simply something that happens at the end of the course.', 'This week focuses on ways that we can help children to live and learn in a world of change. We will consider the importance of cultivating creativity and acknowledging multiple types of intelligence. We will also look at learning that takes place informally outside of school. We will identify key features of excellent practice in schools and look at the benefits of professional development. This is the final week of this course. If you have stayed with us to the end, congratulations! This may be an ending but it is also a beginning as you move on to the next course.'],)","([],)","(['Foundations of Teaching for Learning is a program of study primarily for people who are currently teaching but have had no formal teacher education. This course is an introductory one that considers the three domains of being a teacher:  Professional Knowledge and Understanding; Professional Practice; and Professional Values, Relationships and Engagement.'],)","(['English'],)","(['Commonwealth Education Trust'],)","(['Foundations of Teaching for Learning: Introduction'],)",https://d3njjcbhbojbot.cloudfront.net/api/utilities/v1/imageproxy/https://coursera-course-photos.s3.amazonaws.com/83/41f9c04cff11e7a517a190e78ba697/course-introduction.jpg?auto=format%2Ccompress&dpr=2&exp=-10&blur=10&bri=5&max-w=1000,"(['Professor John MacBeath'],)","(['Quiz 1', 'Quiz 2', 'Reflection on Teaching and Learning', 'Quiz 3', 'Quiz 4', 'Your Learning Story '],)",https://www.coursera.org/learn/teaching,381,"(['Rated 4.5 out of 5 of ', ' ratings'],)","(['3-4 hours per week', 'Pass all graded assignments to complete the course.'],)","(['4 videos', ', ', '4 readings', '4 videos', ', ', '1 reading', '4 videos', ', ', '1 reading', '4 videos', ', ', '1 reading'],)","(['Being a Teacher: A Professional Privilege', 'Thinking About Learning', 'How Good is My Classroom?', 'Continuing to Learn in a Changing World'],)"
"(['In this module, you will learn how to ask others to eat together and how to respond to similar suggestions in Korean. After completing the lesson, you will be able to introduce your favorite food, describe how certain foods taste, suggest something to do together and respond to a suggestion.', 'In this module, you will learn how to introduce famous shopping areas in Korean. After completing the lesson, you will be able to talk about where you are going to shop, describe various kinds of stores, talk about what you want to buy, and describe shopping districts in detail.'],)","(['Beginner students who are familiar with the Korean alphabet'],)","(['Welcome to Learn to Speak Korean 1!\n \nThis course is for beginner students who are familiar with the Korean alphabet, Hangeul. Through this course students will learn the skills essential for daily interactions with Koreans while living in Korea. \n\nThis course consists of six modules, and each module is composed of five units. Each unit has vocabulary, grammar and expressions, conversation practice, video clips, quizzes, a workbook, and vocabulary lists. In order to assist students with their independent studies, Korean learning materials such as lecture notes, workbooks, and vocabulary lists detailing each day\xe2\x80\x99s lecture are also provided. The vocabulary lists are accompanied by English, Chinese, and Japanese translations.\n\nI hope that you enjoy all this program has to offer over the next six weeks. After studying in this program, you will be able to have a real Korean conversation with your newly acquired knowledge of the Korean language. Thank you!\n\nYour Course Team\n\nChief Contents Developer: Sang Mee Han\nContents Developers: Bock Ja Lee, Yoo Kyung Choi, Ha Min Cho,  Ju Eun Kim\nProduction Assistants: Jin Hee Kim, Eun Hye Kim'],)","(['English'],)","(['Yonsei University'],)","(['Learn to Speak Korean 1'],)",https://d3njjcbhbojbot.cloudfront.net/api/utilities/v1/imageproxy/https://coursera-course-photos.s3.amazonaws.com/6b/0bbd403c3a11e687d7cff9394dce84/logo4.jpg?auto=format%2Ccompress&dpr=2&exp=-10&blur=10&bri=5&max-w=1000,"(['Sang Mee Han'],)","(['Graded Quiz 1', 'Graded Quiz 2', 'Graded Quiz 3', 'Graded Quiz 4', 'Graded Quiz 5', 'Graded Quiz 1', 'Graded Quiz 2', 'Graded Quiz 3', 'Graded Quiz 4', 'Graded Quiz 5', 'Graded Quiz 1', 'Graded Quiz 2', 'Graded Quiz 3', 'Graded Quiz 4', 'Graded Quiz 5', 'Graded Quiz 1', 'Graded Quiz 2', 'Graded Quiz 3', 'Graded Quiz 4', 'Graded Quiz 5', 'Graded Quiz 1', 'Graded Quiz 2', 'Graded Quiz 3', 'Graded Quiz 4', 'Graded Quiz 5', 'Graded Quiz 1', 'Graded Quiz 2', 'Graded Quiz 3', 'Graded Quiz 4', 'Graded Quiz 5'],)",https://www.coursera.org/learn/learn-speak-korean1,876,"(['Rated 4.9 out of 5 of ', ' ratings'],)","(['Beginner', '6 weeks of study, 2-4 hours/week', 'Pass all graded assignments to complete the course.'],)","(['6 videos', ', ', '11 readings', '5 videos', ', ', '11 readings', '5 videos', ', ', '11 readings', '5 videos', ', ', '11 readings', '5 videos', ', ', '11 readings', '5 videos', ', ', '11 readings'],)","([""Introducing One's Friends"", ""Introducing One's Hometown"", 'Introducing Food', 'Ordering Food', 'Introducing Places to Shop ', 'Shopping'],)"
