weekabout,targetlearner,description,language,creator,coursename,imageurl,instructors,weekgraded,url,ratingcount,ratingstars,basicinfo,weekinfo,weekname
"(['Welcome to first week of our course! Today we will discuss what bayesian methods are and what are probabilistic models. We will see how they can be used to model real-life situations and how to make conclusions from them. We will also learn about conjugate priors \xe2\x80\x94 a class of models where all math becomes really simple.', 'This week we will about the central topic in probabilistic modeling: the Latent Variable Models and how to train them, namely the Expectation Maximization algorithm. We will see models for clustering and dimensionality reduction where Expectation Maximization algorithm can be applied as is. In the following weeks, we will spend weeks 3, 4, and 5 discussing numerous extensions to this algorithm to make it work for more complicated models and scale to large datasets.', 'This week we will move on to approximate inference methods. We will see why we care about approximating distributions and see variational inference \xe2\x80\x94 one of the most powerful methods for this task. We will also see mean-field approximation in details. And apply it to text-mining algorithm called Latent Dirichlet Allocation', 'This week we will learn how to approximate training and inference with sampling and how to sample from complicated distributions. This will allow us to build simple method to deal with LDA and with Bayesian Neural Networks \xe2\x80\x94 Neural Networks which weights are random variables themselves and instead of training (finding the best value for the weights) we will sample from the posterior distributions on weights.', 'Welcome to the fifth week of the course! This week we will combine many ideas from the previous weeks and add some new to build Variational Autoencoder -- a model that can learn a distribution over structured data (like photographs or molecules) and then sample new data points from the learned distribution, hallucinating new photographs of non-existing people. We will also the same techniques to Bayesian Neural Networks and will see how this can greatly compress the weights of the network without reducing the accuracy.', 'Welcome to the final week of our course! This time we will see nonparametric Bayesian methods. Specifically, we will learn about Gaussian processes and their application to Bayesian optimization that allows one to perform optimization for scenarios in which each function evaluation is very expensive: oil probe, drug discovery and neural network architecture tuning.'],)","(['This course was designed for students with strong mathematical and machine learning background who want to get a different perspective of ML algorithms.\nNote that this is a very advanced course! You must have strong background in statistics, calculus and linear algebra.'],)","(['Bayesian methods are used in lots of fields: from game development to drug discovery. They give superpowers to many machine learning algorithms: handling missing data, extracting  much more information from small datasets. Bayesian methods also allow us to estimate uncertainty in predictions, which is a really desirable feature for fields like medicine. \nWhen Bayesian methods are applied to deep learning, it turns out that they allow you to compress your models 100 folds, and automatically tune hyperparametrs, saving your time and money.\nIn six weeks we will discuss the basics of Bayesian methods: from how to define a probabilistic model to how to make predictions from it. We will see how one can fully automate this workflow and how to speed it up using some advanced techniques. \nWe will also see applications of Bayesian methods to deep learning and how to generate new images with it. We will see how new drugs that cure severe diseases be found with Bayesian methods.'],)","(['English'],)","(['National Research University Higher School of Economics'],)","(['Bayesian Methods for Machine Learning'],)",https://d3njjcbhbojbot.cloudfront.net/api/utilities/v1/imageproxy/https://coursera-course-photos.s3.amazonaws.com/2a/d9b6308bd711e798da81f093f62c3a/Bayesian-machine-learning.png?auto=format%2Ccompress&dpr=2&exp=-10&blur=10&bri=5&max-w=1000,"(['Daniil Polykovskiy', 'Alexander Novikov'],)","(['Introduction to Bayesian methods', 'Conjugate priors', 'EM algorithm', 'Latent Variable Models and EM algorithm', 'EM algorithm for GMM', 'Variational inference', 'Latent Dirichlet Allocation', 'Markov Chain Monte Carlo', 'PyMC', 'Variational autoencoders', 'Variational Autoencoder', 'Categorical Reparametrization with Gumbel-Softmax', 'Gaussian Processes and Bayesian Optimization', 'GPy and GPyOpt', 'Final project: Finding the suspect'],)",https://www.coursera.org/learn/bayesian-methods-in-machine-learning,34,"(['Rated 4.4 out of 5 of ', ' ratings'],)","(['Advanced', '6 weeks of study, 6 hours/week', 'Access to GPUs will be a plus, but you can complete the course without them.', 'Pass all graded assignments to complete the course.'],)","(['9 videos', ', ', '1 reading', '17 videos', '11 videos', '11 videos', '10 videos', ', ', '3 readings', '7 videos'],)","(['Introduction to Bayesian methods & Conjugate priors', 'Expectation-Maximization algorithm', 'Variational Inference & Latent Dirichlet Allocation', 'Markov chain Monte Carlo', 'Variational Autoencoder', 'Gaussian processes & Bayesian optimization', 'Final project'],)"
"([],)","(['Pre-requisites:\n- This course is aimed at individuals with basic knowledge of machine learning, who want to know how to set technical direction and prioritization for their work.\n- It is recommended that you take course one and two of this specialization (Neural Networks and Deep Learning, and Improving Deep Neural Networks: Hyperparameter tuning, Regularization and Optimization) prior to beginning this course.'],)","(['You will learn how to build a successful machine learning project. If you aspire to be a technical leader in AI, and know how to set direction for your team\'s work, this course will show you how.\n\nMuch of this content has never been taught elsewhere, and is drawn from my experience building and shipping many deep learning products. This course also has two ""flight simulators"" that let you practice decision-making as a machine learning project leader. This provides ""industry experience"" that you might otherwise get only after years of ML work experience.\n\nAfter 2 weeks, you will: \n- Understand how to diagnose errors in a machine learning system, and \n- Be able to prioritize the most promising directions for reducing error\n- Understand complex ML settings, such as mismatched training/test sets, and comparing to and/or surpassing human-level performance\n- Know how to apply end-to-end learning, transfer learning, and multi-task learning\n\nI\'ve seen teams waste months or years through not understanding the principles taught in this course. I hope this two week course will save you months of time.\n\nThis is a standalone course, and you can take this so long as you have basic machine learning knowledge. This is the third course in the Deep Learning Specialization.'],)","(['English'],)","(['deeplearning.ai'],)","(['Structuring Machine Learning Projects'],)",https://d3njjcbhbojbot.cloudfront.net/api/utilities/v1/imageproxy/https://coursera-course-photos.s3.amazonaws.com/f1/e756d078c511e79def7f8c8906ac6e/CourseHeaderDL.jpg?auto=format%2Ccompress&dpr=2&exp=-10&blur=10&bri=5&max-w=1000,"(['Andrew Ng', 'Head Teaching Assistant - Kian Katanforoosh', 'Teaching Assistant - Younes Bensouda Mourri'],)","(['Bird recognition in the city of Peacetopia (case study)', 'Autonomous driving (case study)'],)",https://www.coursera.org/learn/machine-learning-projects,"7,915","(['Rated 4.8 out of 5 of ', ' ratings'],)","(['Beginner', '2 weeks of study, 3-4 hours/week', ""None currently, unless you'd like to download Jupyter Notebooks locally for offline work."", 'Pass all graded assignments to complete the course.'],)","(['13 videos', ', ', '1 reading', '11 videos'],)","(['ML Strategy (1)', 'ML Strategy (2)'],)"
"(['In this week, we will first provide an overview on the course\'s content, targeted audiences, the instructor\'s professional background, and tips to succeed in this course. Then we will cover critical material properties in design, such as strength, modulus of elasticity, and the coefficient of thermal expansion. A case study examining material selection in a Zimmer orthopedic hip implant will demonstrate the real life design applications of these material properties. At the end of the week you will have the opportunity to check your own knowledge of these fundamental material properties by taking Quiz 1 ""Material Properties in Design.""', 'In week 2, we will review stress, strength, and the factory of safety. Specifically, we will review axial, torsional, bending, and transverse shear stresses. Please note that these modules are intended for review- students should already be familiar with these topics from their previous solid mechanics, mechanics of materials, or deformable bodies course. For each topic this week, be sure to refresh your analysis skills by working through worksheets 2, 3, 4 and 5. There is no quiz for this week.', 'In this week we will first cover the ductile to brittle transition temperature and stress concentration factors. Then, we will learn two critical static failure theories; the Distortion Energy Theory and Brittle Coulomb-Mohr Theory. A case study featuring the ultimate load testing of the Boeing 777 will highlight the importance of analysis and validation. Be sure to work through worksheets 6, 7, 8 and 9 to self-check your understanding of the course materials. At the end of this week, you will take Quiz 2 \xe2\x80\x9cStatic Failure.\xe2\x80\x9d', 'In week 4, we will introduce critical fatigue principles, starting with fully revisable stresses and the SN Curve. Then, we discuss how to estimate a fully adjusted endurance limit. Finally, a case study covering the root cause analysis of the fatigue failure of the Aloha Airlines flight 293 will emphasize the dangers of fatigue failure.  In this week, you should complete worksheets 10, 11 and 12 as well as Quiz 3 \xe2\x80\x9cFully Reversed Loading in Fatigue.\xe2\x80\x9d', 'In this last week of the course, we will cover the fatigue failure criteria for fluctuating and randomly varying stresses, including key concepts such as the Modified Goodman line and Miner s Rule. This week be sure to complete worksheets 13 and 14 as well as Quiz 4 \xe2\x80\x9cFluctuating Fatigue and Miner s Rule.\xe2\x80\x9d Finally, take Quiz 5, \xe2\x80\x9cThe Comprehensive Quiz\xe2\x80\x9d, which will measure your overall knowledge of this course.'],)","(['This course is aimed at undergraduate students with an interest in machine design, as well as practicing engineers who want to want to enhance their mechanical design and analysis skills. If you are a practicing mechanical engineer who seeks to add to your knowledge of machine design, or an undergraduate student who wants additional learning opportunities out of your classroom, this course is for you.'],)","(['\xe2\x80\x9cMachine Design Part I\xe2\x80\x9d is the first course in an in-depth three course series of \xe2\x80\x9cMachine Design.\xe2\x80\x9d The \xe2\x80\x9cMachine Design\xe2\x80\x9d Coursera series covers fundamental mechanical design topics, such as static and fatigue failure theories, the analysis of shafts, fasteners, and gears, and the design of mechanical systems such as gearboxes. Throughout this series of courses we will examine a number of exciting design case studies, including the material selection of a total hip implant, the design and testing of the wing on the 777 aircraft, and the impact of dynamic loads on the design of an bolted pressure vessel. \n\nIn this first course, you will learn robust analysis techniques to predict and validate design performance and life. We will start by reviewing critical material properties in design, such as stress, strength, and the coefficient of thermal expansion. We then transition into static failure theories such as von Mises theory, which can be utilized to prevent failure in static loading applications such as the beams in bridges.  Finally, we will learn fatigue failure criteria for designs with dynamic loads, such as the input shaft in the transmission of a car.'],)","(['English'],)","(['Georgia Institute of Technology'],)","(['Machine Design Part I'],)",https://d3njjcbhbojbot.cloudfront.net/api/utilities/v1/imageproxy/https://coursera-course-photos.s3.amazonaws.com/0f/b90b206eb511e6a1c0d77b7ec6029c/machine_design_coursera_icon.jpg?auto=format%2Ccompress&dpr=2&exp=-10&blur=10&bri=5&max-w=1000,"(['Dr. Kathryn Wingate'],)","(['Material Properties in Design', 'Static Failure', 'Fully Reversed Loading in Fatigue', 'Fluctuating Fatigue and Miner\xe2\x80\x99s Rule', 'Machine Design Part 1: Comprehensive Exam'],)",https://www.coursera.org/learn/machine-design1,355,"(['Rated 4.8 out of 5 of ', ' ratings'],)","(['Intermediate', 'This class includes 5 weeks of study, 5-7 hours/week.', 'none', 'Pass all graded assignments to complete the course.'],)","(['11 videos', ', ', '4 readings', ', ', '1 practice quiz', '8 videos', ', ', '10 readings', ', ', '1 practice quiz', '9 videos', ', ', '12 readings', '8 videos', ', ', '10 readings', '8 videos', ', ', '10 readings'],)","(['Material Properties in Design', 'Static Failure Theories - Part I', 'Static Failure Theories - Part II', 'Fatigue Failure - Part I', 'Fatigue Failure - Part II'],)"
"([""This week we will introduce you to competitive data science. You will learn about competitions' mechanics, the difference between competitions and a real life data science,  hardware and software that people usually use in competitions. We will also briefly recap major ML models frequently used in competitions."", 'In this module we will summarize approaches to work with features: preprocessing, generation and extraction. We will see, that the choice of the machine learning model impacts both preprocessing we apply to the features and our approach to generation of new ones. We will also discuss feature extraction from text with Bag Of Words and Word2vec, and feature extraction from images with Convolution Neural Networks.', 'We will start this week with Exploratory Data Analysis (EDA). It is a very broad and exciting topic and an essential component of solving process. Besides regular videos you will find a walk through EDA process for Springleaf competition data and an example of prolific EDA for NumerAI competition with extraordinary findings.', 'Finally, in this module we will cover something very unique to data science competitions. That is, we will see examples how it is sometimes possible to get a top position in a competition with a very little machine learning, just by exploiting a data leakage.   ', 'Nowadays it is hard to find a competition won by a single model! Every winning solution incorporates ensembles of models. In this module we will talk about the main ensembling techniques in general, and, of course, how it is better to ensemble the models in practice. '],)","([],)","(['If you want to break into competitive data science, then this course is for you! Participating in predictive modelling competitions can help you gain practical experience, improve and harness your data modelling skills in various domains such as credit, insurance, marketing, natural language processing, sales\xe2\x80\x99 forecasting and computer vision to name a few. At the same time you get to do it in a competitive context against thousands of participants where each one tries to build the most predictive algorithm. Pushing each other to the limit can result in better performance and smaller prediction errors. Being able to achieve high ranks consistently can help you accelerate your career in data science.\n\nIn this course, you will learn to analyse and solve competitively such predictive modelling tasks. \n\nWhen you finish this class, you will:\n\n- Understand how to solve predictive modelling competitions efficiently and learn which of the skills obtained can be applicable to real-world tasks.\n- Learn how to preprocess the data and generate new features from various sources such as text and images.\n- Be taught advanced feature engineering techniques like generating mean-encodings, using aggregated statistical measures or finding nearest neighbors as a means to improve your predictions.\n- Be able to form reliable cross validation methodologies that help you benchmark your solutions and avoid overfitting or underfitting when tested with unobserved (test) data. \n- Gain experience of analysing and interpreting the data. You will become aware of inconsistencies, high noise levels, errors and other data-related issues such as leakages and you will learn how to overcome them. \n- Acquire knowledge of different algorithms and learn how to efficiently tune their hyperparameters and achieve top performance. \n- Master the art of combining different machine learning models and learn how to ensemble. \n- Get exposed to past (winning) solutions and codes and learn how to read them.\n\nDisclaimer : This is not a machine learning course in the general sense. This course will teach you how to get high-rank solutions against thousands of competitors with focus on practical usage of machine learning methods rather than the theoretical underpinnings behind them.\n\nPrerequisites: \n- Python: work with DataFrames in pandas, plot figures in matplotlib, import and train models from scikit-learn, XGBoost, LightGBM.\n- Machine Learning: basic understanding of linear models, K-NN, random forest, gradient boosting and neural networks.'],)","(['English'],)","(['National Research University Higher School of Economics'],)","(['How to Win a Data Science Competition: Learn from Top Kagglers'],)",https://d3njjcbhbojbot.cloudfront.net/api/utilities/v1/imageproxy/https://coursera-course-photos.s3.amazonaws.com/79/35e6f08e6b11e786129d44e814c9e9/How-to-win-a-Kaggle-competition.png?auto=format%2Ccompress&dpr=2&exp=-10&blur=10&bri=5&max-w=1000,"(['Dmitry Ulyanov', 'Alexander Guschin', 'Mikhail Trofimov', 'Dmitry Altukhov', 'Marios Michailidis'],)","(['Recap', 'Pandas basics', 'Graded Soft/Hard Quiz', 'Feature preprocessing and generation with respect to models', 'Feature extraction from text and images', 'Exploratory data analysis', 'Validation', 'Data leakages', 'Data leakages', 'Data leakages', 'Metrics', 'Mean encodings', 'Mean encoding implementation', 'Graded quiz', 'Graded Advanced Features II Quiz', 'KNN features implementation', 'Ensembling implementation', 'Ensembling', 'Final project', 'Final project'],)",https://www.coursera.org/learn/competitive-data-science,58,"(['Rated 4.8 out of 5 of ', ' ratings'],)","(['Advanced', '6-10 hours/week', 'Pass all graded assignments to complete the course.'],)","(['8 videos', ', ', '7 readings', ', ', '3 practice quizzes', '7 videos', ', ', '4 readings', ', ', '2 practice quizzes', '1 video', ', ', '2 readings', '8 videos', ', ', '2 readings', '4 videos', ', ', '3 readings', ', ', '1 practice quiz', '3 videos', ', ', '3 readings', '8 videos', ', ', '3 readings', ', ', '1 practice quiz', '3 videos', ', ', '2 readings', '4 videos', ', ', '4 readings', ', ', '1 practice quiz', '4 videos', ', ', '2 readings', '6 videos', ', ', '4 readings', ', ', '1 practice quiz', '4 videos', ', ', '2 readings'],)","(['Introduction & Recap', 'Feature Preprocessing and Generation with Respect to Models', 'Final Project Description', 'Exploratory Data Analysis', 'Validation', 'Data Leakages', 'Metrics Optimization', 'Advanced Feature Engineering I', 'Hyperparameter Optimization', 'Advanced feature engineering II', 'Ensembling', 'Competitions go through', 'Final Project'],)"
"(['This module introduces the idea of computational thinking, and how big data can make simple problems quite challenging to solve. We use the example of calculating the median and mean stack of a set of radio astronomy images to illustrate some of the issues you encounter when working with large datasets. ', 'In this module we explore the idea of scaling your code. Some algorithms scale well as your dataset increases, but others become impossibly slow. We look at some of the reason for this, and use the example of cross-matching astronomical catalogues to demonstrate what kind of improvements you can make. ', 'Most large astronomy projects use databases to manage their data. In this module we introduce SQL - the language most commonly used to query databases. We use SQL to query the NASA Exoplanet database and investigate the habitability of planets in other solar systems.'],)","(['This course is aimed at science students with an interest in computational approaches to problem solving, people with an interest in astronomy who would like to learn current research methods, or people who would like to improve their programming by applying it to astronomy examples. '],)","(['Science is undergoing a data explosion, and astronomy is leading the way. Modern telescopes produce terabytes of data per observation, and the simulations required to model our observable Universe push supercomputers to their limits. To analyse this data scientists need to be able to think computationally to solve problems. In this course you will investigate the challenges of working with large datasets: how to implement algorithms that work; how to use databases to manage your data; and how to learn from your data with machine learning tools. The focus is on practical skills - all the activities will be done in Python 3, a modern programming language used throughout astronomy.\n\nRegardless of whether you\xe2\x80\x99re already a scientist, studying to become one, or just interested in how modern astronomy works \xe2\x80\x98under the bonnet\xe2\x80\x99, this course will help you explore astronomy: from planets, to pulsars to black holes.\n\nCourse outline:\nWeek 1: Thinking about data\n- Principles of computational thinking\n- Discovering pulsars in radio images\n\nWeek 2: Big data makes things slow\n- How to work out the time complexity of algorithms\n- Exploring the black holes at the centres of massive galaxies\n\nWeek 3: Querying data using SQL\n- How to use databases to analyse your data\n- Investigating exoplanets in other solar systems\n\nWeek 4: Managing your data\n- How to set up databases to manage your data\n- Exploring the lifecycle of stars in our Galaxy\n\nWeek 5: Learning from data: regression\n- Using machine learning tools to investigate your data\n- Calculating the redshifts of distant galaxies\n\nWeek 6: Learning from data: classification\n- Using machine learning tools to classify your data\n- Investigating different types of galaxies\n\nEach week will also have an interview with a data-driven astronomy expert.\n\nNote that some knowledge of Python is assumed, including variables, control structures, data structures, functions, and working with files.'],)","(['English'],)","(['The University of Sydney'],)","(['Data-driven Astronomy'],)",https://d3njjcbhbojbot.cloudfront.net/api/utilities/v1/imageproxy/https://coursera-course-photos.s3.amazonaws.com/0f/79d550ed5311e68a91457769e062c8/banner4.png?auto=format%2Ccompress&dpr=2&exp=-10&blur=10&bri=5&max-w=1000,"(['Tara Murphy', 'Simon Murphy'],)","(['Set up your online assessment', 'Pulsars: test your understanding', 'Calculating the mean stack', 'Supermassive black holes: test your understanding', 'A naive cross-matcher', 'Exoplanets - test your understanding', 'Writing your own SQL queries', 'Stars - test your understanding', 'Setting up your own database', 'Cosmological distances - test your understanding', 'Building a regression classifier', 'Galaxies - test your understanding', 'Exploring machine learning classification'],)",https://www.coursera.org/learn/data-driven-astronomy,136,"(['Rated 4.9 out of 5 of ', ' ratings'],)","(['Intermediate', '6 weeks of study, 4-6 hours/week', ""You'll need to have a computer with internet access."", 'Pass all graded assignments to complete the course.'],)","(['8 videos', ', ', '1 reading', '7 videos', '7 videos', '6 videos', '7 videos', '7 videos', ', ', '1 reading'],)","(['Thinking about data', 'Big data makes things slow', 'Querying your data', 'Managing your data', 'Learning from data: regression', 'Learning from data: classification'],)"
